{
  "binary_sha256": "e222043929361e5b0fe14990e89e83b7f6bf98c11c9413c42e6bb4b16e6f2fb3",
  "cancellation": null,
  "dataset_receipts": [
    {
      "coverage_evaluated": true,
      "data_sha256": "2886f35b8f68769b2129b91095c197eedbbddb90b42af91468f4ecb35a104fd0",
      "dataset_index": 10,
      "dgp_id": "dgp_a_one_factor_n150",
      "digest_authentication": {
        "checks": {
          "base_point_result": 1,
          "bootstrap_schedule_positions": 5000,
          "bootstrap_source_rows": 5000,
          "compiler_analytical_identity": 1,
          "complete_case_universe": 1,
          "delete_one_sampling_positions": 150,
          "delete_one_source_rows": 150,
          "model_scientific_identity": 1,
          "original_sampling_positions": 1,
          "original_source_rows": 1,
          "outer_recipe_analytical_identity": 1,
          "plan": 1,
          "scientific_result": 1,
          "source_dataset_fingerprint": 1
        },
        "compact_evidence_typed_sha256": "2d57cc1ec123badcfdede4215564af8b5c391ca54d8fc71ff02d72254df39d7f",
        "data_sha256": "2886f35b8f68769b2129b91095c197eedbbddb90b42af91468f4ecb35a104fd0",
        "document_typed_sha256": "4abd54ac214637ff0bbbcb9ac0580c9d735b144ab5c4d26115642ddc0a649bba",
        "kind": "cbsem_exact_cfa_interval_coverage_digest_verification_receipt_v1",
        "method": "bound_rust_exact_schedule_and_source_verifier_v1",
        "reasons": [],
        "schema_version": 1,
        "scientific_result_sha256": "757861f7a75cdd2e252ac3c1184744fe27b4aa16b7ce86e9bf212a190a06df08",
        "source_dataset_fingerprint": "af6a9fd6d8417bae240277c01e8e71b9dd99d30d3ffb5197017ec836f09c1c2f",
        "status": "accepted"
      },
      "integrity_reasons": [],
      "ledger": {
        "delete_one_failure_counts_by_kind": {
          "inadmissible_solution": 0,
          "moment_matrix_not_positive_definite": 0,
          "non_convergence": 0,
          "numerical_failure": 0
        },
        "delete_one_failures": 0,
        "delete_one_successes": 150,
        "failure_rate_inference_unit": "dataset_not_bootstrap_replicate",
        "point_failure_counts_by_kind": {
          "inadmissible_solution": 0,
          "moment_matrix_not_positive_definite": 0,
          "non_convergence": 0,
          "numerical_failure": 0
        },
        "point_failures": 0,
        "point_successes": 5000,
        "requested_replicates": 5000,
        "standard_error_unavailable": 0,
        "standard_error_unavailable_counts_by_reason": {
          "derivative_unavailable": 0,
          "information_not_positive_definite": 0,
          "invalid_information_variance_or_standard_error": 0,
          "numerical_information_failure": 0,
          "singular_information": 0
        },
        "studentized_usable": 5000
      },
      "manifest_sha256": "1b550da20ea05873bf8234b99ea203c0e4973fb5d6e774cd0aba0ae980085c78",
      "methods": [
        {
          "available": true,
          "method": "percentile",
          "parameters": [
            {
              "available": true,
              "covered_conditional": true,
              "covered_unconditional": true,
              "interval_lower": 0.6005648163270225,
              "interval_upper": 1.0026258498213756,
              "parameter_id": "parameter_6631_6132"
            },
            {
              "available": true,
              "covered_conditional": true,
              "covered_unconditional": true,
              "interval_lower": 0.45942845208830824,
              "interval_upper": 0.7915073192579651,
              "parameter_id": "parameter_6631_6133"
            },
            {
              "available": true,
              "covered_conditional": true,
              "covered_unconditional": true,
              "interval_lower": 0.07394913973678148,
              "interval_upper": 0.7024029694653288,
              "parameter_id": "residual_variance_6131"
            },
            {
              "available": true,
              "covered_conditional": true,
              "covered_unconditional": true,
              "interval_lower": 0.42634449518914835,
              "interval_upper": 0.8512665143794598,
              "parameter_id": "residual_variance_6132"
            },
            {
              "available": true,
              "covered_conditional": true,
              "covered_unconditional": true,
              "interval_lower": 0.5300412676771317,
              "interval_upper": 0.9191617025513577,
              "parameter_id": "residual_variance_6133"
            },
            {
              "available": true,
              "covered_conditional": true,
              "covered_unconditional": true,
              "interval_lower": 0.9481434142362901,
              "interval_upper": 1.9006541376100214,
              "parameter_id": "variance_6631"
            }
          ]
        },
        {
          "available": true,
          "method": "studentized",
          "parameters": [
            {
              "available": true,
              "covered_conditional": true,
              "covered_unconditional": true,
              "interval_lower": 0.5978264247159991,
              "interval_upper": 0.9735491703399792,
              "parameter_id": "parameter_6631_6132"
            },
            {
              "available": true,
              "covered_conditional": true,
              "covered_unconditional": true,
              "interval_lower": 0.4580752828698288,
              "interval_upper": 0.7817725340702716,
              "parameter_id": "parameter_6631_6133"
            },
            {
              "available": true,
              "covered_conditional": true,
              "covered_unconditional": true,
              "interval_lower": 0.11959495503630141,
              "interval_upper": 0.6989747156107825,
              "parameter_id": "residual_variance_6131"
            },
            {
              "available": true,
              "covered_conditional": true,
              "covered_unconditional": true,
              "interval_lower": 0.4796668624779029,
              "interval_upper": 0.9010809015590022,
              "parameter_id": "residual_variance_6132"
            },
            {
              "available": true,
              "covered_conditional": true,
              "covered_unconditional": true,
              "interval_lower": 0.5640225693547253,
              "interval_upper": 0.966013914651859,
              "parameter_id": "residual_variance_6133"
            },
            {
              "available": true,
              "covered_conditional": true,
              "covered_unconditional": true,
              "interval_lower": 0.9882877867018373,
              "interval_upper": 1.9766652109745575,
              "parameter_id": "variance_6631"
            }
          ]
        },
        {
          "available": true,
          "method": "bca",
          "parameters": [
            {
              "available": true,
              "covered_conditional": true,
              "covered_unconditional": true,
              "interval_lower": 0.5974510580980924,
              "interval_upper": 0.9993954372999762,
              "parameter_id": "parameter_6631_6132"
            },
            {
              "available": true,
              "covered_conditional": true,
              "covered_unconditional": true,
              "interval_lower": 0.45772099483293843,
              "interval_upper": 0.7896015583246382,
              "parameter_id": "parameter_6631_6133"
            },
            {
              "available": true,
              "covered_conditional": true,
              "covered_unconditional": true,
              "interval_lower": 0.09995165002989868,
              "interval_upper": 0.7159732047243266,
              "parameter_id": "residual_variance_6131"
            },
            {
              "available": true,
              "covered_conditional": true,
              "covered_unconditional": true,
              "interval_lower": 0.4582898911415936,
              "interval_upper": 0.880700800000705,
              "parameter_id": "residual_variance_6132"
            },
            {
              "available": true,
              "covered_conditional": true,
              "covered_unconditional": true,
              "interval_lower": 0.5635966840235442,
              "interval_upper": 0.9674759384121473,
              "parameter_id": "residual_variance_6133"
            },
            {
              "available": true,
              "covered_conditional": true,
              "covered_unconditional": true,
              "interval_lower": 0.986365986631039,
              "interval_upper": 1.9465630736963833,
              "parameter_id": "variance_6631"
            }
          ]
        }
      ],
      "oracle": {
        "arithmetic_checks": 78,
        "base_inference_available": true,
        "bca_acceleration_method": "complete_delete_one_jackknife_neumaier_mean_squares_cubes_acceleration_v2",
        "bca_adjusted_probability_method": "efron_bca_statrs_inverse_normal_libm_erfc_cdf_adjustment_v2",
        "bca_inference_available": true,
        "delete_one_failures": 0,
        "delete_one_successes": 150,
        "endpoint_checks": 36,
        "endpoint_relative_tolerance": 1e-12,
        "kind": "cbsem_exact_cfa_interval_coverage_oracle_receipt_v1",
        "parameter_count": 6,
        "percentile_bias_binding_method": "observed_mean_minus_point_binary64_bit_exact_v1",
        "percentile_mean_validation_method": "math_fsum_reference_higham_gamma_b_minus_1_outward_binary64_v1",
        "point_failures": 0,
        "point_successes": 5000,
        "reasons": [],
        "requested_replicates": 5000,
        "schema_version": 1,
        "status": "accepted",
        "studentized_inference_available": true,
        "studentized_usable": 5000
      },
      "scientific_result_sha256": "757861f7a75cdd2e252ac3c1184744fe27b4aa16b7ce86e9bf212a190a06df08",